Razão Social;Fundo;Segmento;Código
SEQUOIA III RENDA IMOBILIÁRIA - FDO. INV. IMOB.;FII SEQUOIA;;SEQR;
SHOPPING WEST PLAZA FDO INV IMOB;FII W PLAZA;;WPLZ;
SINGULARE FDO INV IMOB - FII;FII REIT RIV;;REIT;
SJ AU LOGÍSTICA FDO. INV. IMOB.;FII SJ AU;;SJAU;
SOLARIUM FII - FDO INV. IMOB.;FII SOLARIUM;;SOLR;
SP DOWNTOWN FDO INV IMOB - FII;FII SP DOWNT;;SPTW;
SPA FDO INV IMOB - FII;FII SPA;;SPAF;
SPECIALE BLUE REAL ASSET FDO DE INV IMOB;FII SPECIALE;;LTMT;
SPECIALE REAL ESTATE DEVELOPMENT FDO DE INV IMOB;FII DVLP;;DVLP;
SPECIALE REAL ESTATE DEVELOPMENT II FII;FII DVLT;;DVLT;
SPECIALE REAL ESTATE FUND OF FUNDS FDO DE INV IMOB;FII PMFO;;PMFO;
SPGM FDO DE INV IMOB - RESP LIM;FII SPGM;;SPGM;
SPGM II - FUNDO DE INVESTIMENTO IMOB  RESP LIM;FII SPG2;;SPG2;
SPX SYN DESEN. DE GALPÕES LOG. FEEDER BRADESCO;FII SPXM;;SPXM;
SPX SYN DESENV GALPÕES LOG FEEDER PRIVATE FII;FII SPXG;;SPXG;
SPX SYN DESENVOLVIMENTO DE GALPÕES LOGÍSTICOS;FII SPXL;;SPXL;
STARX FDO INV IMOB - FII;FII STARX;;STRX;
SUNO FUNDO DE FUNDOS DE INVESTIMENTO IMOBILIÁRIO;FII SUNOFOFI;;SNFF;
SUNO LOG FUNDO DE INVESTIMENTO IMOBILIÁRIO;FII SUNO LG;;SNLG;
SUNO MULTIESTRATÉGIA FDO DE INV IMOB;FII SNME;;SNME;
SUNO RECEBÍVEIS IMOBILIÁRIOS FDO DE INV IMOB;FII SUNO CRI;;SNCI;
SUPREMO FUNDO DE INVESTIMENTO IMOBILIÁRIO;FII SUPREMO;;SPMO;
TELLUS DESENVOLVIMENTO LOGÍSTICO FDO. INVEST. IMOB;FII TELLUS;;TELD;
TELLUS MULTIESTRATÉGIA - FDO INV IMOB RESP LTDA;FII TELM;;TELM;
TELLUS PROPERTIES - FDO INV. IMOB;FII TEL PROP;;TEPP;
TISHMAN SPEYER RENDA CORPORATIVA FDO. INV. IMOB.;FII TISHMAN;;TSER;
TIVIO RENDA IMOBILIÁRIA FUNDO DE INVESTIMENTO IMOB;FII TIVIO RI;;TVRI;
TIVIO SECURITIES FUNDO DE INVESTIMENTO IMOBILIÁRIO;FII V MASTER;;VOTS;
TJK RENDA IMOBILIÁRIA FDO INV IMOB;FII TJK REND;;TJKB;
TORDESILHAS EI FDO. INV. IMOB.;FII TORDE EI;;TORD;
TRANSINC FDO INV IMOB - FII;FII TRANSINC;;TSNC;
TREECORP REAL ESTATE FDO INV IMOB - I;FII TREECORP;;TCPF;
TRX HEDGE FUND FDO DE INV IMOB - RESP LIM;FII TRXY;;TRXY;
TRX REAL ESTATE FDO. INV. IMOB. - FII;FII TRX REAL;;TRXF;
TRX REAL ESTATE II FDO. INVEST. IMOB.;FII TRX R II;;TRXB;
URCA HEDGE FUND MULT IMOB FDO INV IMOB - RESP LIM;FII URHF;;URHF;
URCA PRIME RENDA FUNDO DE INVESTIMENTO IMOBILIÁRIO;FII URCA REN;;URPR;
V2 EDIFICIOS CORPORATIVOS FDO INV IMOB - FII;FII V2EDCORP;;VVCO;
V2 MULTI RENDA FUNDO DE INVESTIMENTO IMOBILIÁRIO;FII MULT REN;;VVMR;
V2 RECEBÍVEIS IMOBILIÁRIOS FUNDO DE INVESTIMENTO I;FII V2 RECE;;VVCR;
V2 RENDA IMOBILIÁRIA FDO DE INV IMOB;FII V2 RENDA;;VVRI;
VALORA CRI CDI FUNDO DE INVESTIMENTO IMOBILIÁRIO;FII VALREIII;;VGIR;
VALORA CRI ÍNDICE DE PREÇO FDO INVEST. IMOB. FII;FII VALORAIP;;VGIP;
VALORA CRI INFRA II FII DE RESP. LTDA;FII VGII;;VGII;
VALORA HEDGE FUND FDO. INV. IMOB.;FII VALOR HE;;VGHF;
VALORA RENDA IMOB FUNDO DE INVES IMOB -RESP LIMIT;FII VGRI;;VGRI;
VBI AGRO - FUNDO DE INVESTIMENTO  IMOBILIÁRIO;FII QAGR VBI;;QAGR;
VBI OFFICE FUND II - FDO. INVEST. IMOB.;FII BLMO VBI;;BLMO;
VBI REITS MULTIESTRATÉGIA FDO. INV. IMOB;FII RVBI VBI;;RVBI;
VECTIS JUROS REAL FDO INV. IMOB. - FII;FII VECTIS;;VCJR;
VECTIS RENDA RESIDENCIAL FDO. INV. IMOB.;FII VECT REN;;VCRR;
VECTIS SECURITIES FDO DE INV IMOB RESP LIM;FII VCSC;;VCSC;
VECTOR QUELUZ ATIVOS IMOB FDO INV IMOB;FII VQ LAJES;;VLJS;
VENUS - FUNDO DE INVESTIMENTO IMOBILIÁRIO;FII VENUS;;SALI;
VERA CRUZ THREE FDO DE INV IMOB RESP LIM;FII VCTH;;VCTH;
VERSALHES RECEBÍVEIS IMOBILIÁRIOS - FDO. INV. IMOB;FII VERS CRI;;VSLH;
VIC DESENVOLVIMENTO VINTAGE 20/21 FUND INVEST IMOB;FII VIC DES;;VIDS;
VIC DESENVOLVIMENTO VINTAGE 22/23 FDO DE INV IMOB;FII VIC VIN;;VDSV;
VINCI CREDIT SECURITIES FUNDO DE INVESTIMENTO IMOB;FII VINCI CR;;VCRI;
VINCI IMÓVEIS URBANOS FDO. DE INV. IMOB.;FII VINCI IU;;VIUR;
VINCI INSTRUMENTOS FINANCEIROS FDO INV IMOB - FII;FII VINCI IF;;VIFI;
VINCI LOGÍSTICA FDO INV IMOB - FII;FII VINCI LG;;VILG;
VINCI OFFICES FDO INV IMOB;FII VINCI OF;;VINO;
VINCI OPORTUNIDADE LOGÍSTICA FUN DE INVES IMO RES;FII VIOL;;VIOL;
VINCI SHOPPING CENTERS FDO INVEST IMOB - FII;FII VINCI SC;;VISC;
WARREN SECURITIES FDO DE INV IMOB - FII;FII WARREN;;WSEC;
WHG FINVEST SP REALTY FDO DE INV IMOB - FII;FII WHG F SP;;SPDE;
WHG REAL ESTATE FUNDO DE INVESTIMENTO IMOBILIÁRIO;FII WHG REAL;;WHGR;
XP CORPORATE MACAÉ FDO INV IMOB - FII;FII XP MACAE;;XPCM;
XP CREDITO IMOBILIÁRIO - FDO INV IMOB;FII XP CRED;;XPCI;
XP INDUSTRIAL FDO INV IMOB - FII;FII XP INDL;;XPIN;
XP LOG FDO INV IMOB - FII;FII XP LOG;;XPLG;
XP MALLS FDO INV IMOB FII;FII XP MALLS;;XPML;
XP PROPERTIES FDO. INV. IMOB.;FII XP PROP;;XPPR;
XP SELECTION FDO DE FUNDOS INV IMOB - FII;FII XP SELEC;;XPSF;
XPCE RE FDO INV IMOB;FII XPCE RE;;XPCE;
YUCA FDO INV. IMOB. RESPONSABILIDADE LIMITADA;FII YUCA;;YUFI;
ZAGROS MULTIESTRATÉGIA FDO DE INV IMOB;FII ZAGH;;ZAGH;
ZAVIT CRÉDITO IMOBILIÁRIO - FDO INV IMOB;FII ZAVIT C;;ZAVC;
ZAVIT REAL ESTATE FUND - FDO INV IMOB;FII ZAVIT R;;ZAVI;
ZION CAPITAL FUNDO DE INVESTIMENTO IMOBILIÁRIO FII;FII ZION;;ZIFI;
