Razão Social;Fundo;Segmento;Código
AF INVEST CRI FDO. INV. IMOB - RECEBÍVEIS IMOB.;FII AFHI CRI;;AFHI;
AJ MALLS FDO DE INV IMOB;FII AJ MALLS;;AJFI;
ALIANZA CRÉDITO  IMOBILIÁRIO FUNDO DE INVESTIMENTO;FII ALIANZAC;;ALZC;
ALIANZA MULTIESTRATÉGIA FUNDO DE INVESTIMENTO IMOB;FII ALIANZME;;ALZM;
ALIANZA MULTIOFFICES  - FDO. INV. IMOB;FII MULT OF1;;MTOF;
ALIANZA TÍTULOS IMOB. FDO INV. IMOB.;FII ALIANZAT;;ALZT;
ALIANZA TRUST RENDA IMOBILIARIA FDO INV IMOB;FII ALIANZA;;ALZR;
ALIANZA URBAN HUB RENDA FUNDO DE INVESTIMENTO IMOB;FII ALI URB;;AURB;
APEX REALTY FDO DE INV IMOB  RESP LTDA;FII APXR;;APXR;
APEX URB FDO DE INV IMOB  RESP LTDA;FII APXU;;APXU;
AROEIRA 333 RENDA LOGÍSTICA FDO DE INV IMOB;FII AROA;;AROA;
 ARX DOVER RECEBÍVEIS FDO DE INV IMOB;FII ARXD R;;ARXD;
AUTONOMY EDIFÍCIOS CORPORATIVOS FUND. INV. IMOB.;FII AUTONOMY;;AIEC;
AZ QUEST PANORAMA CRÉDITO ESTRUTURADO FII RESP LTD;FII AZPE;;AZPE;
AZ QUEST PANORAMA LOGISTICA FDO INV IMOB RESP LIM;FII AZPL;;AZPL;
BANESTES RECEBÍVEIS IMOBILIÁRIOS FDO INV IMOB  FII;FII BEES CRI;;BCRI;
BANRISUL NOVAS FRONTEIRAS FDO INV IMOB - FII;FII BANRISUL;;BNFS;
BARRA MALLS FUNDO DE INVESTIMENTO IMOBILIÁRIO;FII BR MALLS;;BTML;
BARZEL CD1 FUNDO DE INVESTIMENTO IMOBILIÁRIO;FII BARZEL;;BZEL;
BASÍLICA PARTNERS GDR FUNDO DE INV IMOB RESP LIM;FII BPDR;;BPDR;
BASÍLICA PARTNERS LED CORPORATE FDO INV IMOB FII;FII BASILICA;;BPLC;
BB FDO INV IMOB PROGRESSIVO;FII BB PROGR;;BBFI;
BB FUNDO DE FUNDOS - FDO. INV. IMOB.;FII BB FOF;;BBFO;
BB PREMIUM MALLS FDO DE INV IMOB RESP LIM;FII BBIG;;BBIG;
BB RENDA CORPORATIVA FDO INV IMOB - FII;FII BB CORP;;BBRC;
BB RENDA DE PAPÉIS IMOBILIÁRIOS FDO INV IMOB - FII;FII BB R PAP;;RNDP;
BGR B32 FUNDO DE INVEST IMOB RESP LIM;FII BGRB;;BGRB;
BLUECAP LOG FUNDO DE INVESTIMENTO IMOBILIÁRIO;FII BLOG;;BLOG;
BLUEMACAW LOGÍSTICA FDO. INVEST. IMOB.;FII BLUE LOG;;BLMG;
BR7 SENADO FUNDO DE INVESTIMENTO IMOBILIÁRIO;FII BR7 SENA;;BRSE;
BRADESCO CARTEIRA IMOBILIÁRIA ATIVA - FII;FII BCIA;;BCIA;
BRAZILIAN GRAVEYARD DEATH CARE FDO INV IMOB - FII;FII DEA CARE;;CARE;
BRC - II FUNDO DE INVESTIMENTO IMOBILIÁRIO;FII RTEL;;RTEL;
BRC RENDA CORPORATIVA FII;FII ATHENA I;;FATN;
BRESCO DESENVOLVIMENTO FDO DE INV IMOB RESP LIM;FII BRCD;;BRCD;
BRESCO LOGÍSTICA - FDO INV IMOB;FII BRESCO;;BRCO;
BRIO CRÉDITO ESTRUTURADO - FDO. INVEST. IMOB.;FII BRIO CRE;;BICE;
BRIO MULTIESTRATÉGIA FDO INV IMOB;FII BRIO ME;;BIME;
BRIO REAL ESTATE II - FDO INV IMOB;FII BRIO II;;BRIM;
BRIO REAL ESTATE III FDO DE INVEST. IMOB.;FII BRIO III;;BRIP;
BRIO REAL ESTATE IV - FUNDO DE INVESTIMENTO IMOB;FII BRIO IV;;BIPD;
BRIO REAL ESTATE V - FII;FII BRIO V;;BIPE;
BRIX FUNDO DE INVESTIMENTO IMOBILIÁRIO;FII BRIX;;BRIX;
BRPR CORPORATE OFFICES FDO DE INV IMOB RESP. LTDA.;FII BROF;;BROF;
BRPR E-TOWER FDO DE INV IMOB;FII BETW;;BETW;
BS2 ALLINVESTMENTS FDO DE INV IMOB;FII BS2;;LLAO;
BTG PACTUAL HOTÉIS FII;BTG HOTEL FI;;BTHI;
BTG PACTUAL LOGISTICA FDO INV IMOB - FII;FII BTLG;;BTLG;
BTG PACTUAL REAL ESTATE HEDGE FUND FII - RESP LTDA;FII BTHF;;BTHF;
BTG PACTUAL YOU INC. DESENV. IMOB. FII RESP LIM;FII BTYU;;BTYU;
BTOWERS FII - FUNDO DE INVESTIMENTO IMOBILIÁRIO;FII BTOWERS;;BTWR;
BTSP I FDO. INVEST. IMOB - FII;FII BTSP I;;BTSG;
BTSP II FUNDO DE INVESTIMENTO IMOBILIÁRIO;FII BTSP II;;BTSI;
CAIXA RIO BRAVO FDO DE FDOS INV IMOB II;FII CX RBRA2;;CRFF;
CAIXA RIO BRAVO FUNDO DE FDO INV IMOB - FII;FII CX RBRAV;;CXRI;
 CANUMA CAPITAL MULTIESTRATÉGIA FDO DE INV IMOB;FII CANUMA;;CCME;
CANUMA CAPITAL RENDA VAREJO FDO INV RESP LIMIT;FII CCVA;;CCVA;
CAPITÂNIA HBC RENDA URBANA FDO INV IMOB RESP LTDA.;FII CPHBC UR;;CPUR;
CAPITÂNIA LOGÍSTICA FDO DE INV IMOB;FII CPLG;;CPLG;
CAPITÂNIA OFFICE FII - FDO DE INV IMOB;FII CPOF;;CPOF;
CAPITÂNIA REIT FOF - FDO. INVEST. IMOB;FII CAP REIT;;CPFF;
CAPITANIA SECURITIES II FDO INV IMOB - RESP LTDA.;FII CAPI SEC;;CPTS;
CAPITÂNIA SHOPPINGS FUNDO DE INVESTIMENTO IMOB;FII CPSH;;CPSH;
CARTESIA RECEBÍVEIS IMOBILIÁRIOS - FUNDO DE INVEST;CARTESIA FII;;CACR;
CASTELLO BRANCO OFFICE PARK FII - FII RESPONS LTDA;FII CBOP PAX;;CBOP;
CATUAÍ VBI TRIPLE A FDO DE INV IMOB;FII BLCA VBI;;BLCA;
CENU - FDO DE INV IMOB;FII CENU;;CENU;
CF2 FUNDO DE INVESTIMENTO IMOBILIÁRIO;FII CF2;;CFHI;
CF3 FUNDO DE INVESTIMENTO IMOBILIÁRIO - FII;FII CF3 IMOB;;CFII;
CIDADE JARDIM CONTINENAL TOWER FDO INV IMOB;FII CJCTOWER;;CJCT;
CIX MUIRAQUITAN FDO DE INV IMOB;FII CIXM;;CIXM;
CIX RENDIMENTO FUNDO DE INVESTIMENTO IMOBILIÁRIO;FII CIX REND;;CIXR;
CLAVE ÍNDICES DE PREÇOS FDO DE INV IMOB;FII CLAVE IN;;CLIN;
COSMIC FDO DE INV IMOB;FII COSMIC;;CSMC;
CPV ENERGIA FDO DE INV IMOB RESP LIM;FII RENV;;RENV;
CVPAR FUNDO DE INVESTIMENTO IMOBILIÁRIO DE CRI;FII CVPAR;;CVPR;
CYRELA CRÉDITO - FUNDO DE INVESTIMENTO IMOBILIÁRIO;FII CYRELA;;CYCR;
CYRELA DESENVOLVIMENTO LOGÍSTICO FDO INV IMOB;FII CYLD;;CYLD;
DAMA FUNDO DE INVESTIMENTO IMOBILIÁRIO RESP LIMITA;FII DAMA;;DAMA;
DAYCOVAL METROPOLIS FUND INVESTIMENTO IMOBILIÁRIO;FII ASA MET;;ASMT;
DAYCOVAL RETROFITS I FDO DE INV IMOB - FII;FII ASA RET;;ASRF;
DEL MONTE AJAX FDO INV IMOB - FII;FII DEL MONT;;DLMT;
DEVANT PROPERTIES FUNDO DE INVESTIMENTO IMOB;FII DEVA PRO;;DPRO;
DEVANT RECEBÍVEIS IMOBILIÁRIOS FDO. INVEST. IMOB.;FII DEVANT;;DEVA;
DIAMANTE FDO INV IMOB;FII DIAMANTE;;DAMT;
DOVEL FDO INV IMOB;FII DOVEL;;DOVL;
EDGE FDO DE INV IMOB RESP LIM;FII EDGE;;EDGE;
EMET MULTIESTRATÉGIA FDO DE INV IMOB;FII EMET;;EMET;
ENERGY RESORT FDO. INVEST. IMOB.;FII ENERGY;;EGYR;
EQI RECEBÍVEIS IMOBILIÁRIOS FDO DE INV IMOBILIÁRIO;FII EQI RECE;;EQIR;
ESTOQUE RESIDENCIAL E COMERCIAL RJ FDO INV IMOB;FII ESTOQ RJ;;ERCR;
EUROPA 105 - FDO INV IMOB;FII EUROPA;;ERPA;
EVEN II KINEA FUNDO DE INVESTIMENTO IMOBILIÁRIO;FII EVEN II;;KEVE;
EXES FUNDO DE INVESTIMENTO IMOBILIÁRIO;FII EXES;;EXES;
FARIA LIMA CAPITAL RECEB. IMOB. I - FDO INV. IMOB.;FII FL RECEB;;FLCR;
FATOR RENDA URBANA FDO DE INV IMOB;FII FARU;;FARU;
FATOR VERITA FDO INV IMOB - FII;FII FATOR VE;;VRTA;
FATOR VERITÀ MULTIESTRATÉGIA FDO INV IMOB;FII VRTM;;VRTM;
FDO BRASÍLIO MACHADO DE INVESTIMENTO IMOBILIÁRIO;FII BRASILIO;;BMII;
FDO DE INV IMOB  CAMPREV SUST PREV DO MUN RESP LIM;FII FIIC;;FIIC;
FDO DE INV IMOB LEBLON REALTY DESENVOLVIMENTO I;FII LEBLON;;LRDI;
FDO DE INV IMOB MAUA CAPITAL MPD DESENV RESID;FII MAUA MPD;;MMPD;
FDO DE INV IMOBILIÁRIO DE CRI INTEGRAL BREI;FII BREI;;IBCR;
FDO DE INV IMOBILIÁRIO DE UNIDADES AUTÔNOMAS II;FII UNID II;;IDGR;
FDO DE INV IMOBILIÁRIO DE UNIDADES AUTÔNOMAS IV;FII IDUA;;IDUA;
FDO DE INVEST IMOB GUARDIAN MULTIESTRATÉGIA I;FII GUARD MU;;GAME;
FDO DE INVEST IMOB TELLUS RIO BRAVO RENDA LOGISTIC;FII SDI LOG;;TRBL;
FDO INV IMOB - FII ANCAR IC;FII ANCAR IC;;ANCR;
FDO INV IMOB - FII ANHANGUERA EDUCACIONAL;FII ANH EDUC;;FAED;
FDO INV IMOB - FII BM BRASCAN LAJES CORPORATIVAS;FII BMBRC LC;;BMLC;
FDO INV IMOB - FII BTG PACTUAL CORP. OFFICE FUND;FII BC FUND;;BRCR;
FDO INV IMOB - FII CAMPUS FARIA LIMA;FII CAMPUSFL;;FCFL;
FDO INV IMOB - FII CENESP;FII CENESP;;CNES;
FDO INV IMOB - FII CEO CYRELA COMMERC. PROPERTIES;FII CEO CCP;;CEOC;
FDO INV IMOB - FII EDIFÍCIO ALMIRANTE BARROSO;FII ALMIRANT;;FAMB;
FDO INV IMOB - FII EDIFÍCIO GALERIA;FII GALERIA;;EDGA;
FDO INV IMOB - FII ELDORADO;FII ELDORADO;;ELDO;
FDO INV IMOB - FII HOSPITAL DA CRIANÇA;FII CRIANCA;;HCRI;
FDO INV IMOB - FII HOSPITAL NOSSA SRA DE LOURDES;FII LOURDES;;NSLU;
FDO INV IMOB - FII HOTEL MAXINVEST;FII HOTEL MX;;HTMX;
FDO INV IMOB - FII MAX RETAIL;FII MAX RET;;MAXR;
FDO INV IMOB - FII NOVO HORIZONTE;FII NOVOHORI;;NVHO;
FDO INV IMOB - FII PARQUE D. PEDRO SHOPPING CENTER;FII D PEDRO;;PQDP;
FDO INV IMOB - FII PATEO BANDEIRANTES;FII PTO BAND;;PATB;
FDO INV IMOB - FII RBR RENDIMENTO HIGH GRADE;FII RBRHGRAD;;RBRR;
FDO INV IMOB - FII REC RECEBIVEIS IMOBILIARIOS;FII REC RECE;;RECR;
FDO INV IMOB - FII REC RENDA IMOBILIARIA;FII REC REND;;RECT;
FDO INV IMOB - FII SHOPPING PARQUE D. PEDRO;FII SHOP PDP;;SHDP;
FDO INV IMOB - FII SIA CORPORATE;FII SIA CORP;;SAIC;
FDO INV IMOB - FII TORRE ALMIRANTE;FII TORRE AL;;ALMI;
FDO INV IMOB - FII TORRE NORTE;FII TORRE NO;;TRNT;
FDO INV IMOB - OURINVEST RE I;FII WTC SP;;WTSP;
FDO INV IMOB - VBI LOGÍSTICO;FII LVBI VBI;;LVBI;
FDO INV IMOB BR HOTEIS - FII;FII BRHOTEIS;;BRHT;
FDO INV IMOB BRASIL PLURAL ABSOLUTO FDO DE FUNDOS;FII ABSOLUTO;;BPFF;
FDO INV IMOB BRASIL VAREJO - FII;FII B VAREJO;;BVAR;
FDO INV IMOB BTG PACTUAL SHOPPINGS;FII BTG SHOP;;BPML;
FDO INV IMOB BTG PACTUAL TERRAS AGRÍCOLAS;FII BTG TAGR;;BTRA;
FDO INV IMOB CAIXA CARTEIRA IMOBILIÁRIA;FII CAIXA CI;;CXCI;
FDO INV IMOB CAIXA CEDAE;FII CX CEDAE;;CXCE;
FDO INV IMOB CAIXA SEQ LOGÍSTICA RENDA;FII CX TRX;;CXTL;
FDO INV IMOB CENTRO TEXTIL INTERNACIONAL;FII C TEXTIL;;CTXT;
FDO INV IMOB CJ - FII;FII CJ;;CJFI;
FDO INV IMOB CONTINENTAL SQUARE FARIA LIMA;FII S F LIMA;;FLMA;
FDO INV IMOB DESENV ESCRITÓRIOS BOUTIQUE RESP LIM;FII EGDB;;EGDB;
FDO INV IMOB EDIFÍCIO OURINVEST;FII OURINVES;;EDFO;
FDO INV IMOB EUROPAR;FII EUROPAR;;EURO;
FDO INV IMOB EZTB - FII;FII EZTB;;EZTB;
FDO INV IMOB GRAND PLAZA SHOPPING;FII ABC IMOB;;ABCP;
FDO INV IMOB GREEN TOWERS;FII G TOWERS;;GTWR;
FDO INV IMOB HERMES;FII HERMES;;HERM;
FDO INV IMOB HOSPITAL UNIMED CAMPINA GRANDE;FII UNIMED C;;HUCG;
FDO INV IMOB HOSPITAL UNIMED SUL CAPIXABA;FII H UNIMED;;HUSC;
FDO INV IMOB INDUSTRIAL DO BRASIL;FII INDL BR;;FIIB;
FDO INV IMOB INFRA REAL ESTATE - FII;FII INFRA RE;;FINF;
FDO INV IMOB JK D - FII;FII JKD;;JKDF;
FDO INV IMOB JK E - FII;FII JKE;;JKEF;
FDO INV IMOB MEMORIAL OFFICE;FII MEMORIAL;;FMOF;
FDO INV IMOB MV9 - FII;FII MV9;;MVFI;
FDO INV IMOB OURINVEST LOGÍSTICA;FII OURILOG;;OULG;
FDO INV IMOB PANAMBY;FII PANAMBY;;PABY;
FDO INV IMOB PEDRA NEGRA RENDA IMOB;FII P NEGRA;;FPNG;
FDO INV IMOB POLO ESTOQUE II - FII;FII POLO II;;ESTQ;
FDO INV IMOB POLO SHOPPING INDAIATUBA - RESP. LTDA;FII POLO SHO;;VPSI;
FDO INV IMOB PROJETO ÁGUA BRANCA;FII A BRANCA;;FPAB;
FDO INV IMOB QUINTAS;FII QUINTAS;;QNTS;
FDO INV IMOB RBR CREDITO IMOB ESTRUTURADO;FII RBR PCRI;;RBRY;
FDO INV IMOB RBR PROPERTIES - FII;FII RBR PROP;;RBRP;
FDO INV IMOB RENDA CORPORATIVA ANGICO - FII;FII ANGICO;;ANGC;
FDO INV IMOB RIO BRAVO RENDA CORPORATIVA;FII RIOB RC;;RCRB;
FDO INV IMOB RIO BRAVO RENDA EDUCACIONAL - FII;FII RIOB ED;;RBED;
FDO INV IMOB RIO BRAVO RENDA VAREJO - FII;FII RIOB VA;;RBVA;
FDO INV IMOB RIO NEGRO - FII;FII RIONEGRO;;RNGO;
FDO INV IMOB SC 401;FII SC 401;;FISC;
FDO INV IMOB SCP;FII SCP;;SCPF;
FDO INV IMOB SF - FII;FII SF;;SFFI;
FDO INV IMOB SHOPPING PÁTIO HIGIENÓPOLIS;FII HIGIENOP;;SHPH;
FDO INV IMOB SMART REAL ESTATE - FII RESP LIMITADA;FII SMRE;;SMRE;
FDO INV IMOB TG ATIVO REAL;FII TG ATIVO;;TGAR;
FDO INV IMOB TG RENDA URBANA - RESP LIM;FII TGRU;;TGRU;
FDO INV IMOB TM - FII;FII TM;;TMFI;
FDO INV IMOB VBI RENDIMENTOS IMOB I FII;FII BARI VBI;;BARI;
FDO INV IMOB VEREDA - FII;FII VEREDA;;VERE;
FDO INV IMOB VIA PARQUE SHOPPING - FII;FII V PARQUE;;FVPQ;
FDO INV IMOB VIDA NOVA - FII;FII VIDANOVA;;FIVN;
FDO INV IMOB VOTORANTIM BII BTS;FII VBII BTS;;FBTS;
FDO INV IMOB VOTORANTIM LOGISTICA;FII VOT LOG;;VTLT;
FDO INV IMOB VOTORANTIM SHOPPING;FII VOT SHOP;;VSHO;
FDO INV. IMOB. - AVM FII;FII AVM;;FAVM;
FDO INV. IMOB. GV BLUE CHIP;FII GV BLUE;;FIGV;
FDO INV. IMOB. PLURAL RECEBIVEIS;FII PLURAL R;;PLCR;
FDO INV. IMOB. PLUS;FII PLUS;;VTPL;
FDO INV. IMOB. REC LOGISTICA;FII REC LOG;;RELG;
FDO INV. IMOB. VBI CRI;FII CVBI PAX;;CVBI;
FDO INV. MAUA CAPITAL RECEBIVEIS IMOB. - FII;FII MAUA;;MCCI;
FDO. INV. IMOB. A - TOWN;FII A TOWN;;ATWN;
FDO. INV. IMOB. BTG PACTUAL AGRO LOGÍSTICA;FII BTG AGRO;;BTAL;
FDO. INV. IMOB. CAIXA IMÓVEIS CORPORATIVOS;FII CEF CORP;;CXCO;
FDO. INV. IMOB. HOUSI;FII HOUSI;;HOSI;
FDO. INV. IMOB. MOGNO HOTEIS;FII MOGNO HT;;MGHT;
FDO. INV. IMOB. VBI PRIME PROPERTIES;FII PVBI VBI;;PVBI;
FDO. INVEST. IMOB. DEVANT FOF IMOBILIÁRIOS;FII DEVA FOF;;DVFF;
FDO. INVEST. IMOB. RB CAPITAL I FUNDO DE FUNDOS;FII RB CFOF;;RFOF;
FDO. INVEST. IMOB. VOTORANTIM PATRIMONIAL V;FII VOTP V;;VTPA;
FDO. INVEST. IMOB. VOTORANTIM PATRIMONIAL XII;FII VOTP XII;;VTXI;
FIGTREE RENDA EDUCACIONAL FDO INV IMOB;FII FTRE;;FTRE;
FII - FII BTG PACTUAL FUNDO DE FUNDOS RESPONS LTDA;FII BC FFII;;BCFF;
FII - FII NCH BRASIL RECEBÍVEIS IMOBILIÁRIOS;FII NCH BR;;NCHB;
FII BTG PACTUAL CRÉDITO IMOBILIÁRIO;FII BTG CRI;;BTCI;
FII HIRE RESIDENCIAL I - FDO DE INV IMOB;FII HIRE RES;;HRES;
FII INTERMEDIÁRIO NAVI TOT;INTERMED NT;;N4V1;
FII IRIDIUM RECEBÍVEIS IMOBILIÁRIOS;FII IRIDIUM;;IRDM;
FII VERA CRUZ CRI RESID HIGH GRADE - RESP LIMIT;FII VCHG;;VCHG;
 FLORIANO FUNDO DE INVESTIMENTO IMOBILIÁRIO;FII FLNR;;FLNR;
FOF JHSF CAPITAL INSTITUCIONAL - FII;FII JCIN;;JCIN;
FRAM CAPITAL HELMER MULTI RENDA PREF FDO INV IMOB;FII HLMB;;HLMB;
FRAM CAPITAL SBCLOG FDO. INV. IMOB.;FII SBCLOG;;SBCL;
FRONTEIRA MULTI FUNDO DE INVESTIMENTO IMOBILIÁRIO;FII FRONT;;FRHY;
FUND. DE INVEST. IMOBILIÁRIO GUARDIAN REAL ESTATE;FII GUARDIAN;;GARE;
FUND. INVEST. IMOB. SUCCESPAR VAREJO;FII S VAREJO;;SPVJ;
FUNDO DE FDO INV IMOB KINEA FII;FII KINEAFOF;;KFOF;
FUNDO DE INV IMOB RBR CRÉD PULVERIZADO RESP LTDA;FII PULV;;PULV;
FUNDO DE INV IMOB ROOFTOP III RESP LIMIT;FII HOMS;;HOMS;
FUNDO DE INVEST IMOBILIARIO SUNO ENERGIAS LIMPAS;FII SUNO EL;;SNEL;
FUNDO DE INVESTIMENTO IMOBILIÁRIO - BLUE RECEBÍVEI;FII BLUE REC;;BLUR;
FUNDO DE INVESTIMENTO IMOBILIÁRIO - DEVELOPMENT V1;FII DEV ONE;;LKDV;
FUNDO DE INVESTIMENTO IMOBILIÁRIO - FII RBR DESENV;FII RBR III;;RBRI;
FUNDO DE INVESTIMENTO IMOBILIÁRIO - SPX SYN MULT;FII SPX SYN;;SPXS;
FUNDO DE INVESTIMENTO IMOBILIÁRIO APEX MALLS - FII;FII APEX MS;;APXM;
FUNDO DE INVESTIMENTO IMOBILIÁRIO CAIXA AGÊNCIAS;FII CAIXA AG;;CXAG;
FUNDO DE INVESTIMENTO IMOBILIÁRIO HBC RENDA URBANA;FII HBC REN;;HBCR;
FUNDO DE INVESTIMENTO IMOBILIÁRIO MACAM SHOPPING;FII BLUE;;BLUE;
FUNDO DE INVESTIMENTO IMOBILIÁRIO MINT EDUCACIONAL;FII MINT EDU;;MINT;
FUNDO DE INVESTIMENTO IMOBILIARIO PATRIMONIAL IV;FII PATRI IV;;OPTM;
FUNDO DE INVESTIMENTO IMOBILIÁRIO RIZA TERRAX;FII RIZA TX;;RZTR;
FUNDO DE INVESTIMENTO IMOBILIÁRIO ROOFTOP I;FII ROOFTOPI;;ROOF;
FUNDO DE INVESTIMENTO IMOBILIÁRIO SOFIA;FII SOFF;;SOFF;
G5 CIDADE NOVA FDO. INVEST. IMOB.;FII TOUR V;;TCIN;
GALAPAGOS DESENVOLVIMENTO LOGÍSTICO FII RESP LIM;FII GCDL;;GCDL;
GALAPAGOS RECEBÍVEIS IMOBILIÁRIOS - FDO. INV. IMOB;FII GLPG CRI;;GCRI;
GALAPAGOS SPECIAL OPORTUNITIES FII;FII GALAP SP;;GCOI;
GAZIT MALLS FUNDO DE INVESTIMENTO IMOBILIÁRIO;FII GAZIT;;GZIT;
GENERAL SHOP E OUTLETS DO BRASIL FDO INV IMOB - FI;FII GENERAL;;GSFI;
GENERAL SHOPPING ATIVO E RENDA FUNDO DE INV, IMOB.;FII GEN SHOP;;FIGS;
GENESIS MULTIESTRATÉGIA FDO INV. IMOB.;FII VX XVI;;VXXV;
GENIAL LOGÍSTICA FUNDO DE INVESTIMENTO IMOBILIÁRIO;FII PLURAL L;;GLOG;
GENIAL MALLS FUNDO DE INVESTIMENTO IMOBILIÁRIO;FII MALLS BP;;MALL;
GGR COVEPI RENDA FDO INV IMOB RESPONSAB LTDA;FII GGRCOVEP;;GGRC;
GREEN ROCK - FDO INV IMOB;FII GREEN RO;;GRRO;
GRUPO RCFA FDO INV IMOB;FII GP RCFA;;RCFA;
HABITAT RECEBÍVEIS PULVERIZADOS - FII;FII HABIT II;;HABT;
HAZ FDO INV IMOB - FII;FII HAZ;;ATCR;
HCO OPPS AERO I FDO DE INV IMOB RESP LIM;FII AERO;;AERO;
HECTARE CE - FDO INV IMOB;FII HECTARE;;HCTR;
HECTARE DESENV. STUDENT HOUSING - FDO. INV. IMOB.;FII HECT DES;;HCST;
HECTARE RECEBÍVEIS HIGH GRADE FDO. INV. IMOB.;FII HECT CRI;;HCHG;
HEDGE AAA FDO. INV. IMOB.;FII HEDGEAAA;;HAAA;
HEDGE ATRIUM SHOPPING SANTO ANDRE FDO INV IMOB;FII HATRIUM;;ATSA;
HEDGE BRASIL LOGÍSTICO IND FUND INV IMOB RESP LIM;FII HGBL;;HGBL;
HEDGE BRASIL SHOPPING FDO INV IMOB;FII HEDGEBS;;HGBS;
HEDGE CORPORATE OFFICES FDO DE INV IMOB RESP LIM;FII HCOF;;HCOF;
HEDGE DESENVOLVIMENTO LOGÍSTICO FDO INV IMOB;FII HEDGE DV;;HDEL;
HEDGE FLORIPA SHOPPING FUNDO INV IMOBI;FII FLORIPA;;FLRP;
HEDGE LOGÍSTICA FDO. INV. IMOB.;FII HEDGELOG;;HLOG;
HEDGE OFFICE INCOME FUNDO DE INVESTIMENTO IMOB.;FII HOFFICEI;;HOFC;
HEDGE PALADIN DESIGN OFFICES FDO INV IMOB;FII HEDGE OF;;HDOF;
HEDGE REALTY DEVELOPMENT FDO INV IMOB;FII HREALTY;;HRDF;
HEDGE RECEBIVEIS IMOB. FUNDO DE INVST. IMOB.;FII HEDGEREC;;HREC;
HEDGE SEED FUNDO DE INVESTIMENTO IMOBILIÁRIO;FII HEDGE SD;;SEED;
HEDGE SHOPPING PARQUE DOM PEDRO FDO. DE INV. IMOB.;FII HEDGEPDP;;HPDP;
HEDGE TOP FOFII 3 FDO INV IMOB;FII HTOPFOF3;;HFOF;
HEDGE YEES HABITAÇÕES ECON FDO DE INV IMOB RESP L;FII YEES;;YEES;
HGI CRÉDITOS IMOBILIÁRIOS FDO. INV. IMOB.;FII HGI CRI;;HGIC;
HIRE LOG I FDO DE INV IMOB;FII HIRE LOG;;HILG;
HSI ATIVOS FINANCEIROS FUNDO DE INVESTIMENTO IMOBI;FII HSI CRI;;HSAF;
HSI LOGÍSTICA FUNDO DE INVESTIMENTO IMOBILIÁRIO;FII HSI LOG;;HSLG;
HSI MALL FDO INV IMOB;FII HSI MALL;;HSML;
HSI RENDA IMOB FDO INV IMOB;FII HSIRENDA;;HSRE;
HUSI FDO INV. IMOB.;FII HUSI;;HUSI;
 ICATU VANGUARDA CRÉDITO IMOB FDO DE INV IMOB LTDA;FII IVCI;;IVCI;
ICATU VANGUARDA GRU LOG FDO DE INV IMOB - RESP LIM;FII GRUL;;GRUL;
ÍCONE - FUNDO DE INVEST IMOB RES LIMITADA;FII ICNE;;ICNE;
IMMOB I FDO INV IMOB - FII;FII RENOVA;;RNOV;
IMMOB III - GALPOES E LAJES CORP. FDO INV. IMOB.;FII IMOB III;;FMOB;
IMMOB V DESENVOLVIMENTO FDO. INVEST. IMOB. - FII;FII IMMOB V;;IMMV;
INTER DESENVOLVIMENTO FDO DE INV IMOB;FII INDE;;INDE;
INTER LOGÍSTICO FUNDO DE INVESTIMENTO IMOBILIÁRIO;FII INTER LG;;INLG;
INTER RESIDENCE FUNDO DE INVESTIMENTO IMOBILIÁRIO;FII INTER RD;;INRD;
INTER TEVA INDICE DE PAPEL FUNDO DE INVESTIMENTO;FII INTER IP;;ITIP;
 INTER TEVA INDICE DE TIJOLO FUNDO DE INVESTIMENTO;FII INTER IT;;ITIT;
INVISTA BRAZILIAN BUSINESS PARK FDO DE INV IMOB;FII IBBP;;IBBP;
INVISTA SCJ - FII;FII ISCJ;;ISCJ;
IRB INTERNACIONAL FDO INV IMOB -FII;FII IRB INT;;IRBL;
IRIDIUM FUNDO DE INVESTIMENTO IMOBILIÁRIO;FII IRIM;;IRIM;
ITAÚ CRÉDITO IMOB IPCA FDO DE INV IMOB;FII CI IPCA;;ICRI;
ITAÚ TEMPUS FUNDO DE INVESTIMENTO IMOBILIÁRIO;FII ITAU TEM;;TMPS;
ITAÚ TOTAL RETURN FDO DE INV IMOB;FII ITRI;;ITRI;
JACARANDÁ 02 FUNDO DE INVESTIMENTO IMOBILIÁRIO FII;FII JCDB 02;;JCDB;
JACARANDÁ I FUNDO DE INVESTIMENTO IMOBILIÁRIO -FII;FII JCDA I;;JCDA;
 JASC RENDA VAREJO ESSENCIAL FDO DE INV IMOB - FII;FII JASC REN;;JASC;
JBFO FOF FDO INV. IMOB.;FII JBFO FOF;;JBFO;
JFDCAM FUNDO DE INVESTIMENTO IMOBILIÁRIO FII;FII JFDCAM;;VJFD;
JFL LIVING FDO. INV. IMOB.;FII JFL LIV;;JFLL;
JGP DESENVOLVIMENTO I FDO INV IMOB RESP LIMIT;FII RDLS;;RDLS;
JHSF CAPITAL CIDADE JARDIM - FDO DE INV IMOB;FII JHSF CJ;;JCCJ;
JPP CAPITAL FDO INV IMOB - FII;FII JPP CAPI;;JPPC;
JPP CAPITAL RECEBIVEIS IMOB. FDO. INVEST. IMOB.;FII JPPA CRI;;JPPA;
JS ATIVOS FINANCEIROS FDO DE INV IMOBILIÁRIO;FII JS A FIN;;JSAF;
JS REAL ESTATE MULTIGESTÃO - FII;FII JS REAL;;JSRE;
JS RECEBÍVEIS IMOBILIÁRIOS FDO DE INV IMOB;FII JSCR;;JSCR;
JT PREV FDO INV IMOB DESENVOLVIMENTO HABITACIONAL;FII JT PREV;;JTPR;
JUBARTE BGS LOGÍSTICA DE GRÃOS DESENVOLVIMENTO FII;FII BGS1;;BGS1;
KILIMA FIC FDO. IMOB. SUNO 30;FII KILIMA;;KISU;
KILIMA VOLKANO RECEBÍVEIS IMOB FDO DE INV IMOB;FII KIVO;;KIVO;
KINEA AQUISIÇÕES RESIDENCIAIS FII RESP LIM;FII KRES;;KRES;
KINEA CO-INVESTIMENTO FDO INV IMOB;FII KINEA CO;;003H;
KINEA CREDITAS FDO DE INV IMOBILIÁRIO - FII;FII KINEA CR;;KCRE;
KINEA DESENVOLVIMENTO LOGÍSTICO FDO DE INV IMOB;FII KINEA DL;;KLOG;
KINEA FÊNIX FII - RESP LIM;FII KFEN;;KFEN;
KINEA HEDGE FUND FDO DE INV IMOB;FII KINEA HF;;KNHF;
KINEA HIGH YIELD CRI FDO INV IMOB - FII;FII KINEA HY;;KNHY;
KINEA II REAL ESTATE EQUITY FDO INV IMOB;FII KII REAL;;KNRE;
KINEA ÍNDICES DE PREÇOS FDO INV IMOB - FII;FII KINEA IP;;KNIP;
KINEA OPOR IMOB I FUNDO DE INVEST IMB LTDA;FII KOPI;;KOPI;
KINEA OPORTUNIDADES REAL ESTATE FDO DE INV IMOB;FII KORE;;KORE;
KINEA PREMIUM PROPERTIES FDO INV IMOB;FII KINEA PR;;KNPR;
KINEA PRIME RESIDENCIAL I FDO INV IMOB - RESP LIM;FII KPMR;;KPMR;
KINEA PRIME RESIDENCIAL I PVT FII- RESP LTDA.;FII KPRP;;KPRP;
KINEA RENDA IMOBILIÁRIA FDO INV IMOB - FII;FII KINEA;;KNRI;
KINEA RENDIMENTOS IMOBILIÁRIOS FDO INV IMOB - FII;FII KINEA RI;;KNCR;
KINEA SECURITIES FDO. DE INV. IMOB. - FII;FII KINEA SC;;KNSC;
KINEA UNIQUE HY CDI FUNDO DE INVESTIMENTO IMOB;FII KINEA UN;;KNUQ;
LAGO DA PEDRA - FUNDO DE INVESTIMENTO IMOBILIÁRIO;FII LAGO PDR;;LPLP;
LAV SLDZ DESENVOLVIMENTO IMOB FDO INV IMOB;FII LAV SLDZ;;SLDZ;
LCP REAL ESTATE DEVELOPMENT FII RESP LIM;FII LRED;;LRED;
 LCP SPECIAL OPPORTUNITIES I FDO INV IMOB RESP;FII LSOI;;LSOI;
LEGATUS SHOPPINGS FDO. INV. IMOB. - FII;FII LEGATUS;;LASC;
LESTE RIVA EQUITY PREFERENCIAL I FDO. INV. IMOB.;FII LESTE PA;;LSPA;
LIFE CAPITAL PARTNERS FUNDO DE INVESTIMENTO IMOB;FII LIFE;;LIFE;
LOFT I - FDO INV IMOB;FII LOFT I;;LOFT;
LOFT II FUNDO DE INVESTIMENTO IMOBILIÁRIO;FII LOFT II;;LFTT;
MANATÍ CAPITAL HEDGE FUND FDO INV IMOB;FII MANATI;;MANA;
MARESIAS FUNDO DE INVESTIMENTO IMOBILIÁRIO;FII MMVE OP;;MMVE;
MAUÁ CAPITAL LOGÍSTICA FUNDO DE INVESTIMENTO IMOB;FII MCLO;;MCLO;
MAUÁ CAPITAL REAL ESTATE FDO DE INV IMOB;FII MAUA RE;;MCRE;
MAXI RENDA FDO INV IMOB - FII;FII MAXI REN;;MXRF;
MB BI FDO INV IMOB;FII MB BI;;MBBI;
MÉRITO CEMITÉRIOS FII - FDO DE INV IMOB;FII MCEM;;MCEM;
MÉRITO DESENVOLVIMENTO IMOBILIÁRIO I FII - FII;FII MERITO I;;MFII;
MERITO FDO. AÇÕES IMOB. FII - FDO INV. IMOB.;FII MERITOFA;;MFAI;
MÉRITO RECEBÍVEIS IMOBILIÁRIOS FII - FDO INV IMOB;FII MERITO R;;MFCR;
MINHA CASA FINANCIADA FII RESP LIMITADA;FII MCFY;;MCFY;
MOGNO PROPERTIES FUNDO DE INVESTIMENTO IMOBILIARIO;FII MGRI;;MGRI;
MULTI SHOPPINGS FDO INV IMOB - FII;FII MULTSHOP;;SHOP;
MULTIGESTÃO RENDA COMERCIAL FDO INV IMOB - FII;FII MTGESTAO;;DRIT;
MULTIOFFICES 2 - FDO. INV. IMOB.;FII MULT OF2;;MOFF;
NAVI CRÉDITO IMOBILIÁRIO - FDO INV IMOB;FII NAVI CRI;;NCRI;
NAVI IMOBILIÁRIO TOTAL RETURN FDO. INVEST. IMOB.;FII NAVI TOT;;NAVT;
NAVI RESIDENCIAL FUNDO DE INVESTIMENTO IMOBILIÁRIO;FII NAVI RSD;;APTO;
NEST EAGLE FDO DE INV IMOB RESP LIM;FII EAGL;;EAGL;
NEWPORT LOGÍSTICA FDO INV. IMOB.;FII NEWPORT;;NEWL;
NEWPORT RENDA URBANA FDO INV IMOB;FII NEWRU;;NEWU;
NOVA I - FDO INV IMOB - FII;FII NOVA I;;NVIF;
OCTO FDO DE INV IMOB;FII OCTO;;OCRE;
ONDA DESENVOLVIMENTO IMOB FDO DE INV IMOB;FII ONDV;;ONDV;
OPEN K ATIVOS E RECEBIVEIS  IMOBILIARIOS - FII;FII ATRIO;;ARRI;
OPPORTUNITY BALASSIANO FDO DE INV IMOB;FII OPPBAL;;OBAL;
OPPORTUNITY FDO INV IMOB - RESPONS LIMITADA;FII OPPORTUN;;FTCE;
OURINVEST JPP FDO INV IMOB - FII;FII OURI JPP;;OUJP;
PANORAMA CREDITO RESIDENCIAL  FDO DE INV IMOB;FII PNCR;;PNCR;
PANORAMA DESENVOLVIMENTO LOGÍSTICO FDO. INV. IMOB.;FII PANORAMA;;PNDL;
PANORAMA LAST MILE SBC FDO INV IMOB;FII LASTMILE;;PNLM;
PANORAMA PROPERTIES FDO. INVEST. IMOB.;FII PAN PROP;;PNPR;
PANORAMA REAL ESTATE CRÉDITO FDO INV IMOB;FII PNRC;;PNRC;
PARAMIS HEDGE FUND FDO DE INV IMOB;FII PMIS;;PMIS;
PARKING PARTNERS FDO. INVEST. IMOB.;FII PARK PAR;;VTVI;
PARQUE ANHANGUERA FDO. INVEST. IMOB.;FII PARQ ANH;;PQAG;
PATAGÔNIA CAPITAL MULTIESTRATÉGIA FDO DE INV IMOB;FII PATA;;PATA;
PÁTRIA EDIFÍCIOS CORPORATIVOS FDO INV IMOB - FII;FII PATC VBI;;PATC;
PÁTRIA ESCRITÓRIOS - FDO INV IMOB - RESPONSAB LTDA;FII HGRE PAX;;HGRE;
PÁTRIA IMOBILIÁRIO FOF - FII - RESPONSAB LTDA.;FII HGFF PAX;;HGFF;
PÁTRIA LOG - FDO INV IMOB - RESPONSABILIDADE LTDA.;FII HGLG PAX;;HGLG;
PÁTRIA LOGÍSTICA FUNDO DE INVESTIMENTO IMOBILIÁRIO;FII PATL PAX;;PATL;
PÁTRIA PRIME OFFICES - FII - RESPONSABILIDADE LTDA;FII HGPO PAX;;HGPO;
PÁTRIA RECEBÍVEIS IMOBILIÁRIOS - FII - RESP. LTDA.;FII HGCR PAX;;HGCR;
PÁTRIA RENDA URBANA - FII - RESPONSABILIDADE LTDA.;FII HGRU PAX;;HGRU;
PERFORMA REAL ESTATE - FDO. INV. IMOB.;FII PERFORMA;;PEMA;
PERSONALE I FDO INV IMOB - FII;FII PERSONAL;;PRSN;
POLO CREDITO IMOBILIARIO- FII;FII POLO CRI;;PORD;
POLO FDO INV IMOB - FII RECEBÍVEIS IMOBILIÁRIOS I;FII POLO I;;PLRI;
PRAIA DO CASTELO FUNDO DE INVESTIMENTO IMOBILIÁRIO;FII PRAIA CS;;PCAS;
PRAZO - FUNDO DE INVESTIMENTO IMOBILIÁRIO - FII;FII PRAZO;;PRZS;
PRESIDENTE VARGAS FDO INV IMOB;FII P VARGAS;;PRSV;
PROLOGIS BRAZIL LOGISTICS VENTURE FDO INV IMOB;FII PROLOGIS;;PBLV;
PROPP I FUNDO DE INVESTIMENTO IMOBILIÁRIO - FII;FII IMOF I;;IMOF;
QUARTZO REAL ESTATE DEVELOPMENT MULTI FII RESP LIM;FII QTZD;;QTZD;
RAIZZ DESENVOLVIMENTO I FUNDO DE INVESTIMENTO IMOB;FII RZZV;;RZZV;
RAIZZ DESENVOLVIMENTO II FII RESP. LIMITADA;FII RZZI;;RZZI;
RAIZZ RENDA LOGÍSTICA FUNDO DE INVESTIMENTO IMOB.;FII RZZR;;RZZR;
RB CAPITAL DESENV RESID III FDO INV IMOB - FII;FII RBRESID3;;RSPD;
RB CAPITAL DESENV. RESID. II FDO INV IMOB - FII;FII RBRESID2;;RBDS;
RB CAPITAL DESENV. RESIDENCIAL IV FDO. INV. IMOB.;FII RBRES IV;;RBIR;
RB CAPITAL LOGÍSTICO FDO. INV. IMOB.YE;FII RBCAP LG;;RBLG;
RB CAPITAL RECEBÍVEIS IMOB. FDO. INVEST. IMOB FII;FII RBCAP RI;;RRCI;
RB CAPITAL RENDA I FDO INV IMOB - FII;FII RB CAP I;;FIIP;
RB CAPITAL RENDA II FDO INV IMOB - FII RESP LTDA.;FII RB II;;RBRD;
RB CAPITAL TFO SITUS FDO INV IMOB - FII;FII RB TFO;;RBTS;
RBR ALPHA MULTIESTRATÉGIA REAL ESTATE FDO INV IMOB;FII RBRALPHA;;RBRF;
RBR DESENV COMERCIAL FEEDER FOF FDO INVEST IMOB;FII RBR FEED;;RCFF;
RBR DESENVOLVIMENTO COMERCIAL I - FDO DE INV IMOB;FII RDCI;;RDCI;
RBR DESENVOLVIMENTO LOGÍSTICO I - FII RESP LIMITAD;FII RDLI;;RDLI;
RBR FLAGSHIP I FUNDO DE INVESTIMENTO IMOB RES LIM;FII SHIP;;SHIP;
RBR LOG FUNDO DE INVESTIMENTO IMOBILIÁRIO;FII RBR LOG;;RBRL;
RBR PLUS MULTIESTRATÉGIA REAL ESTATE FII;FII RBR MULT;;RBRX;
RBR PREMIUM RECEBÍVEIS IMOBILIÁRIOS FDO INV IMOB;FII RBR PR;;RPRI;
RBR TOP OFFICES FDO DE INV IMOB RESP LIM;FII TOPP;;TOPP;
REAG MULTI ATIVOS IMOBILIÁRIOS - FII;FII REAGMULT;;RMAI;
REAL INVESTOR FUNDO DE INVESTIMENTO IMOBILIÁRIO;FII REAL INV;;RINV;
REC FDO DE CRI COTAS AMORT FDO DE INV IMOB - R LIM;FII RECD;;RECD;
REC MULTIESTRATÉGIA FDO INV IMOB RESP LIM;FII RECM;;RECM;
RIO BRAVO CREDITO IMOB HIGH GRADE FUND DE INVEST;FII RBCRI IV;;RBHG;
RIO BRAVO CRÉDITO IMOB. HIGH YIELD FDO. INV. IMOB.;FII RB YIELD;;RBHY;
RIO BRAVO CRÉDITO IMOBILIÁRIO II FDO INV IMOB -FII;FII RIOBCRI2;;RBVO;
RIO BRAVO FUNDO DE FUNDOS DE INVESTIMENTO IMOB;FII RIOB FF;;RBFF;
RIO BRAVO OPORTUNIDADES IMOBILIÁRIAS FII;FII MERC BR;;RBOP;
RIO BRAVO RENDA RESIDENCIAL FDO. INVEST. IMOB.;FII RIOB RR;;RBRS;
RIZA AKIN FDO. INV. IMOB. FII;FII RIZA AKN;;RZAK;
RIZA ARCTIUM REAL ESTATE FDO INV IMOB;FII ARCTIUM;;RZAT;
RIZA LECCI FUNDO DE INVESTIMENTO IMOB RESP LIM;FII RZLC;;RZLC;
ROCK - FII FUNDO DE INVESTIMENTO IMOBILIÁRIO;FII ROCK;;RCKF;
SANTANDER PAPEIS IMOB CDI FDO INV IMOB;FII SANT PAP;;SADI;
SANTANDER PAPÉIS IMOBILIÁRIOS FDO DE INV IMOB;FII SAPI;;SAPI;
SANTANDER RENDA DE ALUGUÉIS FDO. INVEST. IMOB.;FII SANT REN;;SARE;
SAO DOMINGOS FDO INV IMOB - FII;FII DOMINGOS;;FISD;
